<?xml version="1.0" encoding="UTF-8"?>
<!DOCTYPE Menu SYSTEM "menu.dtd">
<Menu>
    <Meals>
        <Item>
            <Name>Beetroot and Feta Salad</Name>
            <Price>$15.00</Price>
            <Description>Fresh organic beetroot, crumbled feta, walnuts, and balsamic glaze.</Description>
            <Image>Beetroot and Feta Salad.jpg</Image>
        </Item>
        <Item>
            <Name>Sourdough Rye Sandwich</Name>
            <Price>$18.00</Price>
            <Description>Artisan sourdough rye with smoked turkey, avocado, and house mayo.</Description>
            <Image>Sourdough Rye Sandwich.jpg</Image>
        </Item>
        <Item>
            <Name>Spinach Pie and Salad</Name>
            <Price>$20.00</Price>
            <Description>Traditional Greek spanakopita served with a side of Mediterranean salad.</Description>
            <Image>Spinach Pie and Salad.jpg</Image>
        </Item>
        <Item>
            <Name>Feta Pancakes with Salad</Name>
            <Price>$19.50</Price>
            <Description>Savory feta pancakes topped with microgreens and cherry tomatoes.</Description>
            <Image>Feta Pancakes with Salad.jpg</Image>
        </Item>
    </Meals>
    <Beverages>
        <Category name="Coffee &amp; Hot Chocolates">
            <Item>
                <Name>Cappuccino</Name>
                <Size>
                    <Name>Small</Name>
                    <Price>$3.50</Price>
                </Size>
                <Size>
                    <Name>Regular</Name>
                    <Price>$4.00</Price>
                </Size>
                <Size>
                    <Name>Large</Name>
                    <Price>$4.50</Price>
                </Size>
                <Description>Rich espresso with velvety steamed milk and a deep layer of micro-foam.</Description>
                <Image>Cappuccino.jpg</Image>
            </Item>
            <Item>
                <Name>Latte</Name>
                <Size>
                    <Name>Small</Name>
                    <Price>$3.50</Price>
                </Size>
                <Size>
                    <Name>Regular</Name>
                    <Price>$4.00</Price>
                </Size>
                <Size>
                    <Name>Large</Name>
                    <Price>$4.50</Price>
                </Size>
                <Description>Smooth espresso mixed with steamed milk and a light layer of foam.</Description>
                <Image>Latte.jpg</Image>
            </Item>
            <Item>
                <Name>Signature Hot Chocolate</Name>
                <Size>
                    <Name>Small</Name>
                    <Price>$3.50</Price>
                </Size>
                <Size>
                    <Name>Regular</Name>
                    <Price>$4.00</Price>
                </Size>
                <Size>
                    <Name>Large</Name>
                    <Price>$4.50</Price>
                </Size>
                <Description>Rich, decadent melted cocoa served with steamed milk and marshmallows.</Description>
                <Image>Signature Hot Chocolate.jpg</Image>
            </Item>
        </Category>
        <Category name="Other Beverages">
            <Item>
                <Name>Soda</Name>
                <Price>$3.00</Price>
                <Description>Refreshing carbonated drink.</Description>
                <Image>Soda.jpg</Image>
            </Item>
            <Item>
                <Name>Fresh Orange Juice</Name>
                <Price>$6.00</Price>
                <Description>Freshly squeezed, 100% pure organic orange juice.</Description>
                <Image>Fresh Orange Juice.jpg</Image>
            </Item>
            <Item>
                <Name>Bottled water</Name>
                <Price>$2.00</Price>
                <Description>Natural spring water.</Description>
                <Image>Water Bottled.jpg</Image>
            </Item>
            <Item>
                <Name>English Breakfast Tea</Name>
                <Price>$4.00</Price>
                <Description>A robust and full-bodied classic black tea.</Description>
                <Image>English Breakfast Tea.jpg</Image>
            </Item>
        </Category>
    </Beverages>
</Menu>
